_id,author,date,section,sub_title,text,title,url
18,Gazeta do Povo,,educacao,,"S o b r e   a   i n d i c a ç ã o   d e   q u e   o   p r e s i d e n t e   J a i r   B o l s o n a r o   i r á     d e m i t i r   o   m i n i s t r o   d a   E d u c a ç ã o ,   R i c a r d o   V é l e z ,   o   f i l ó s o f o   e   e s c r i t o r   O l a v o   d e   C a r v a l h o   g a r a n t i u ,,,   q u e   n ã o   v a i   s e   l a m e n t a r   s e   o   "" b o t a r e m   ( s i c )   p a r a   f o r a   d o   m i n i s t é r i o "" ,   a l é m   d e   d i z e r   q u e ,   s e   t i v e s s e   c o n h e c i m e n t o   d a s   "" o b s c e n a s   t u c a n a d a s   e   c l i n t o n a d a s "" ,   t e r i a   s e   p r e v e n i d o   c o n t r a   o   "" c o m p o r t a m e n t o   t r a i ç o e i r o ""   d o   m i n i s t r o .,,"" C o n h e c i   o   p r o f .   V e l e z   p o r   s e u s   l i v r o s   s o b r e   a   h i s t ó r i a   d o   p e n s a m e n t o   b r a s i l e i r o ,   p u b l i c a d o s   m a i s   d e   v i n t e   a n o s   a t r á s .   N u n c a   t o m e i   c o n h e c i m e n t o   d a s   s u a s   o b s c e n a s   t u c a n a d a s   e   c l i n t o n a d a s ,   q u e   t e r i a m   m e   p r e v e n i d o   c o n t r a   o   s e u   c o m p o r t a m e n t o   t r a i ç o e i r o .   N ã o   v o u   f a z e r   n a d a   c o n t r a   e l e ,   m a s   g a r a n t o   q u e   n ã o   v o u   l a m e n t a r   s e   o   b o t a r e m   ( s i c )   p a r a   f o r a   d o   m i n i s t é r i o "" ,   e s c r e v e u   o   f i l ó s o f o .,E m   r e u n i ã o   c o m   j o r n a l i s t a s ,   n a   m a n h ã   d e   h o j e   ( 5 ) ,   B o l s o n a r o   i n d i c o u   q u e   o   c o l o m b i a n o   d e i x a r á   o   c o m a n d o   d o   M i n i s t é r i o   d a   E d u c a ç ã o   ( M E C ) .,V é l e z ,   n o   e n t a n t o ,   q u e   e s t e v e   e m   C a m p o s   d o   J o r d ã o ,   S ã o   P a u l o ,   n o   1 8 º   F ó r u m   L i d e ,   d i s s e   q u e   n ã o   c o n v e r s o u   c o m   B o l s o n a r o   e   n ã o   e s t a v a   s a b e n d o   d a   i n d i c a ç ã o   d e   B o l s o n a r o .   U m   v í d e o   p u b l i c a d o   n a s   r e d e s   m o s t r a   u m a   b r e v e   f a l a   d o   m i n i s t r o   d i z e n d o :,O   M E C   v i v e   u m a   c r i s e   i n t e r n a   q u e   e n v o l v e   d e m i s s õ e s ,   d i s p u t a s   e n t r e   g r u p o s   e   r e c u o s   d e   a ç õ e s .   D e s d e   q u e   i n i c i o u   à   f r e n t e   d o   m i n i s t é r i o ,   o   c o l o m b i a n o   t e m   s i d o   c r i t i c a d o   p o r   s u a   a d m i n i s t r a ç ã o .,E m   m e n o s   d e   t r ê s   m e s e s   d e   g o v e r n o ,   V é l e z   R o d r í g u e z   j á   e x o n e r o u   d e z e n a s   d e   p e s s o a s   e m   p o s t o s - c h a v e   n o   M i n i s t é r i o   d a   E d u c a ç ã o   ( M E C ) ,   v o l t o u   a t r á s   e m   v á r i a s   d e c i s õ e s   e   t o m o u   u m a   s é r i e   d e   m e d i d a s   d e s a s t r o s a s .,E m   a u d i ê n c i a   p ú b l i c a ,   n o   e n t a n t o ,   e l e   d i s s e   q u e   s ó   v a i   s e   d e m i t i r   s e   B o l s o n a r o   p e d i r .,"" N ã o   v o u   s a i r "" ;   "" N ã o   s e g u i r e i   d i c a s   p a r a   r e n u n c i a r "" ;   "" N ã o   r e n u n c i o ,   n ã o   f a z   s e n t i d o "" ;   "" S ó   m e   d e m i t o   s e   o   p r e s i d e n t e   d a   R e p ú b l i c a   p e d i r ,   s e   e l e   a c h a r   q u e   m i n h a   c o l a b o r a ç ã o   n ã o   e s t á   s e n d o   a d e q u a d a "" ;   "" É   u m   a b a c a x i   d o   t a m a n h o   d e   u m   b o n d e ,   m a s   t o p e i "" ,   d i s s e   a   d e p u t a d o s ,   n a   C â m a r a .",Populares,https://www.gazetadopovo.com.br/educacao/olavo-de-carvalho-sobre-possivel-demissao-de-velez-nao-vou-me-lamentar/
6,Agência Estado,,republica,,"O   l í d e r   d o   M D B   n a   C â m a r a ,   B a l e i a   R o s s i   ( S P ) ,   p r o t o c o l o u   a   p r o p o s t a   d e   e m e n d a   à   C o n s t i t u i ç ã o   ( P E C )   p a r a   a l t e r a r   o   s i s t e m a   t r i b u t á r i o   n o   p a í s   e   a   m e s a   d i r e t o r a   d a   C a s a   r e c e b e u   o   t e x t o   n e s t a   s e x t a - f e i r a   ( 5 ) .,E m   u m a   a r t i c u l a ç ã o   e n v o l v e n d o   o   p r e s i d e n t e   d a   C â m a r a ,   R o d r i g o   M a i a   ( D E M - R J ) ,   e   o u t r o s   l í d e r e s   p a r t i d á r i o s ,   a   p r o p o s t a   d r i b l o u   o   g o v e r n o   e   f o i   a p r e s e n t a d a   a n t e s   q u e   a   e q u i p e   e c o n ô m i c a   e n v i a s s e   o   s e u   p r o j e t o .   U m a   r e f o r m a   t r i b u t á r i a   e s t á   s e n d o   g e s t a d a   p e l a   e q u i p e   d o   m i n i s t r o   d a   E c o n o m i a ,,,O s   p a r l a m e n t a r e s   d e c i d i r a m   a d o t a r   u m a   p r o p o s t a   d o   e c o n o m i s t a   B e r n a r d   A p p y ,   d o   C e n t r o   d e   C i d a d a n i a   F i s c a l   ( C C i F ) .   E l e   d e f e n d e   a   c r i a ç ã o   d e   u m   n o v o   t r i b u t o   d e   b e n s   e   s e r v i ç o s ,   d o   t i p o   i m p o s t o   d e   v a l o r   a g r e g a d o   ( I V A ) ,   c o m   a   u n i f i c a ç ã o   d o   P I S / C o f i n s ,   I P I ,   I C M S   e   I S S ,   c o m   t r a n s i ç ã o   d e   1 0   a n o s .,A   r e f o r m a   t r i b u t á r i a   é   u m a   d a s   b a n d e i r a s   d o   M D B .   P a r a   B a l e i a   R o s s i ,   a   n o v a   r e f o r m a   t r i b u t á r i a   t r a r á   u m   e f e i t o   m u i t o   p o s i t i v o   s o b r e   o   c r e s c i m e n t o   d o   P r o d u t o   I n t e r n o   B r u t o   ( P I B )   e   d a   r e n d a   d e   t o d o s   o s   b r a s i l e i r o s .   E l e   d e f e n d e   a   s i m p l i f i c a ç ã o   d a   t r i b u t a ç ã o   p a r a   q u e   t o d a   a   s o c i e d a d e   s e j a   b e n e f i c i a d a .,A p e s a r   d a   r e f o r m a   t r i b u t á r i a   t e r   s i d o   p r o t o c o l a d a   n e s t a   s e m a n a ,   p a r l a m e n t a r e s   a f i r m a m   q u e   e l a   n ã o   a t r a p a l h a r á   a   t r a m i t a ç ã o   d a,,   a t é   p o r q u e   d e v e r á   s e r   a n a l i s a d a   p o s t e r i o r m e n t e .",Populares,https://www.gazetadopovo.com.br/republica/pec-da-reforma-tributaria-protocolada-na-camara-por-mdb/
5,Gazeta do Povo,,curitiba,,"D e p o i s   d e   u m a   s e m a n a   d e   c a l o r ,   C u r i t i b a   t e r á   u m   f i m   d e   s e m a n a   c o m   t e m p e r a t u r a s   m a i s   a m e n a s .   T a n t o   n o   s á b a d o   ( 6 )   q u a n t o   n o   d o m i n g o   ( 7 ) ,   o s   t e r m ô m e t r o s   d e v e m   s o f r e r   u m a   q u e d a   s i g n i f i c a t i v a ,   t r a z i d a   p e l a   p r e s e n ç a   d e   u m a   f r e n t e   f r i a   q u e   c h e g o u   à   r e g i ã o   n e s t a   s e x t a - f e i r a   ( 5 ) .   P a r a   q u e m   e s t a v a   p l a n e j a n d o   f a z e r   a t i v i d a d e s   a o   a r   l i v r e ,   a   p a r t e   r u i m   é   q u e ,   a l é m   d e   e s f r i a r ,   a   c a p i t a l   p o d e r á   t e r   c h u v a s   a   q u a l q u e r   h o r a   n o s   d o i s   d i a s .,“ O   c é u   f i c a   m a i s   f e c h a d o   e m   b o a   p a r t e   d o   s á b a d o   e   d o   d o m i n g o ” ,   e s t i m a   o   m e t e o r o l o g i s t a   S a m u e l   B r a u n ,   d o   S i m e p a r .   A s   n u v e n s   a c a b a m   f i c a n d o   m a i s   c a r r e g a d a s   e s p e c i a l m e n t e   d u r a n t e   a   t a r d e ,   q u a n d o   h á   m a i s   p r o b a b i l i d a d e   d e   e p i s ó d i o s   d e   i n s t a b i l i d a d e ,   q u e   d e v e m   v a r i a r   e n t r e   g a r o a s   e   c h u v a s   f r a c a s .,S e g u n d o   o   m e t e o r o l o g i s t a ,   c o m o   a   f r e n t e   f r i a   j á   s e   e s t a b e l e c e u ,   n ã o   é   e s p e r a d o   q u e   c h o v a   d e   m a n e i r a   m a i s   i n t e n s a .   J á   n a   m a n h ã   d e   s á b a d o ,   a   s e n s a ç ã o   t é r m i c a   d i m i n u i   d e v i d o   a o s   v e n t o s   g e l a d o s .   A   p r e v i s ã o   é   d e   q u e   o s   t e r m ô m e t r o s   v a r i e m   p o u c o ,   e n t r e   a   m í n i m a   d e   1 5 º C   e   a   m á x i m a   d e   2 3 º C .   O   s o l   p o d e   a p a r e c e r   e n t r e   n u v e n s ,   m a s   n ã o   d e   m a n e i r a   s i g n i f i c a t i v a   s u f i c i e n t e   p a r a   e s q u e n t a r   a   t a r d e .,N o   d o m i n g o ,   e n q u a n t o   i s s o ,   a   t e m p e r a t u r a   d e v e r á   v a r i a r   m u i t o   p o u c o   e n t r e   o   i n í c i o   d a   m a n h ã   e   o   f i m   d a   n o i t e .   A   m í n i m a   e s t á   p r e v i s t a   p a r a   1 8 º C   e   a   m á x i m a   p a r a   2 2 º C .   H á   m e n o s   p r o b a b i l i d a d e   e   c h u v a   p a r a   e s t e   d i a .,N a s   p r a i a s   d o   P a r a n á ,   a s   t e m p e r a t u r a s   f i c a m   m a i s   a l t a s   n o   f i m   d e   s e m a n a ,   m a s   a   f r e n t e   f r i a   s e   m o s t r a   p r i n c i p a l m e n t e   p o r   m e i o   d a   c h u v a .   E m   G u a r a t u b a ,   M a t i n h o s   e   P o n t a l   d o   P a r a n á ,   o   s á b a d o   t e m   e p i s ó d i o s   m a i s   i s o l a d o s   d e   c h u v a   d e   m é d i a   i n t e n s i d a d e ,   e n q u a n t o   o   d o m i n g o   p o d e r á   c h e g a r   a   t e r   t e m p e s t a d e s   f o r t e s .   N a s   t r ê s   c i d a d e s ,   o   s á b a d o   t e m   p r e v i s ã o   d e   t e m p e r a t u r a   m í n i m a   d e   1 9 º C   e   m á x i m a   d e   2 7 º C .   J á   o   d o m i n g o   f i c a   e n t r e   2 1 º C   e   2 5 º C .",Populares,https://www.gazetadopovo.com.br/curitiba/previsao-do-tempo-curitiba-regiao-06-04-2019/
8,"Raphael Sibila, especial para a Gazeta do Povo",,republica,,"“ S e   v o c ê   n ã o   t e m   a   c a p a c i d a d e   d e   c o n v e n c e r   a s   p e s s o a s ,   c o m o   v a i   f a z e r   d e m o c r a c i a ? ” .   E s t a   p e r g u n t a   f o i   f e i t a   p e l o   e x - p r e s i d e n t e   F e r n a n d o   H e n r i q u e   C a r d o s o ,   q u e   p a r t i c i p o u   d o   p a i n e l   ‘ D e m o c r a c i a ?   C r i s e   o u   A m a d u r e c i m e n t o '   n a   B r a z i l   C o n f e r e n c e ,   e m   B o s t o n ,   n o s   E s t a d o s   U n i d o s .,O   e v e n t o   a c o n t e c e   a n u a l m e n t e   e   e s t á   n a     5 ª   e d i ç ã o .   P a r t i c i p a m   d i v e r s o s,e   é   p r o m o v i d o   p o r   e s t u d a n t e s   d a   U n i v e r s i d a d e   d e   H a r v a r d   e   d o   M I T .,F H C ,   q u e   t a m b é m   f o i   m i n i s t r o   d a   F a z e n d a   e n t r e   9 3   e   9 4 ,   q u e s t i o n o u   a,e n t r e   o   m i n i s t r o   d a   E c o n o m i a ,   P a u l o   G u e d e s ,   e   p a r l a m e n t a r e s .,“ O s   d o i s   l a d o s   e s t a v a m   m u i t o   a g r e s s i v o s ,   m a s   o   m i n i s t r o   e s t a v a   m u i t o   m a i s   r e a t i v o .   E s s a   i n c a p a c i d a d e   d e   t o c a r   n a q u i l o   q u e   é   s e n s í v e l   p a r a   o   p o v o   e   p a r a   o s   p a r l a m e n t e a r e s   é   u m   p r o b l e m a .   E   e l e   v a i   p r e c i s a r   e n t e n d e r   i s s o ” .,F H C   p a r t i c i p o u   d o   p a i n e l   p o r   q u a s e   d u a s   h o r a s   e   a b o r d o u   d i v e r s o s   t e m a s   a t u a i s   d a   p o l í t i c a   n a c i o n a l .   E n t r e   e l e s ,   a   d i f i c u l d a d e   q u e   o   g o v e r n o   B o l s o n a r o   e s t á   e n c o n t r a n d o   e m   n e g o c i a r   c o m   o   C o n g r e s s o .   “ P a r a   g o v e r n a r   n a   d e m o c r a c i a ,   p r e c i s a   d e   a p o i o   d o s   p a r t i d o s .   P r e c i s a   d e   u m a   c o a l i z ã o .   E s s a   c o a l i z ã o   i m p l i c a   n u m a   d i s t r i b u i ç ã o   d e   p o d e r .   E s s a   d i s t r i b u i ç ã o   d e   p o d e r   é   s e m p r e   t r a n s m i t i d a   p e l a   o p i n i ã o   p ú b l i c a   c o m o   a l g o   s u s p e i t o ,   c h e i a   d e   i n t e r e s s e s   e s c u s o s ” .,S e g u n d o   o   e x - p r e s i d e n t e ,   h á   m o t i v o s   p a r a   q u e   o s   e l e i t o r e s   s u s p e i t e m   d a s   n e g o c i a ç õ e s   p o r   a p o i o .   “ A   L a v a   J a t o   m o s t r o u   é   q u e   o   s i s t e m a   p o l í t i c o   b r a s i l e i r o   e s t á   b a s e a d o   n a   c o r r u p ç ã o ” ,   d i s s e .,O   e x - p r e s i d e n t e   t e m   s i d o   u m   c r í t i c o   d a   a t u a l   g e s t ã o .   R e c e n t e m e n t e ,   e m   e n t r e v i s t a   à   B B C   B r a s i l ,   F e r n a n d o   H e n r i q u e   a f i r m o u   q u e   o   G o v e r n o   B o l s o n a r o   é   p i o r   d o   q u e   e l e   i m a g i n a v a .,D u r a n t e   o   p a i n e l   e m   B o s t o n ,   e v i t o u   f a z e r   d u r a s   c r í t i c a s   a o   a t u a l   p r e s i d e n t e ,   a p e s a r   d e   t e r   s e   r e f e r i d o   a   B o l s o n a r o   a o   f a l a r   d o   G o l p e   d e   6 4 .   “,,   p o r q u e   o   a t u a l   p r e s i d e n t e   d i s s e   q u e   n ã o   f o i .   N ã o   f o i   p o r q u e   e l e   n ã o   e s t a v a   l á ” ,   a r r a n c a d o   r i s o s   d o   p ú b l i c o   n o   a u d i t ó r i o .,A l é m   d e   F H C ,   p a r t i c i p a r a m   d o   p a i n e l   C a r l o s   P e r e i r a ,   p r o f e s s o r   d e   C i ê n c i a s   P o l í t i c a s   d a   F u n d a ç ã o   G e t ú l i o   V a r g a s ,   S t e v e n   L e v i t s k y ,   p r o f e s s o r   d e   G o v e r n o   d a   U n i v e r s i d a d e   d e   H a r v a r d ,   e   F r a n c e s   H a g o p i a n ,   c i e n t i s t a     p o l í t i c a   t a m b é m   d e   H a r v a r d .,D o i s   t e m a s   f o r a m   b a s t a n t e   d e b a t i d o s .   U m   d e l e s   f o i   a   p o l a r i z a ç ã o   d a   p o l í t i c a   b r a s i l e i r a   e   o   i m p e a c h m e n t   d a   e x - p r e s i d e n t e   D i l m a   R o u s s e f f .   “ A l g u m a   c o i s a   v a i   m a l .   N ó s   t i v e m o s   p o u c o s   p r e s i d e n t e s   e l e i t o s   p e l o   p o v o .   O   p r i m e i r o   f o i   o   C o l l o r ,   e   s o f r e u   i m p e a c h m e n t .   O   s e g u n d o   f u i   e u ,   e s c a p e i .   D e p o i s   f o i   o   p r e s i d e n t e   L u l a ,   n ã o   s o f r e u   i m p e a c h m e n t ,   m a s   e s t á   n a   c a d e i a .   V e i o   a   p r e s i d e n t e   D i l m a   q u e   s o f r e u   i m p e a c h m e n t ,   e   a g o r a   t e m   o   p r e s i d e n t e   B o l s o n a r o . ”,,O   p r o f e s s o r   S t e v e n   L e v i s t s k y   f e z   u m a   d u r a   c r í t i c a   a 
 p o l a r i z a ç ã o   a t u a l   d a   p o l í t i c a   n a c i o n a l .   “ A   p o l a r i z a ç ã o   m a t o u   a   d e m o c r a c i a   n o 
 C h i l e   e   n a   V e n e z u e l a .   N o s   ú l t i m o s   5   a n o s   a s   p e s s o a s   n o   B r a s i l   n ã o   a c e i t a m   a 
 o p i n i ã o   d o s   o u t r o s .   A s   p e s s o a s   d e   e s q u e r d a   c h a m a m   o s   d e   d i r e i t a   d e   f a s c i s t a s   e 
 g o l p i s t a s .   J á   o s   d e   d i r e i t a   d i z e m   q u e   o   G o v e r n o   P T   é   m a i s   p e r i g o s o   q u e   o   g o v e r n o 
 d a   V e n e z u e l a ” .,P o r   o u t r o   l a d o ,   L e v i t s k y   e l o g i o u   a s   i n s t i t u i ç õ e s   d e m o c r á t i c a s   d o   B r a s i l ,   d i z e n d o   q u e   s ã o   f o r t e s   e   i n d e p e n d e n t e s ,   e   q u e   o   p a í s   j á   v i v e   u m a   d e m o c r a c i a   m a d u r a ,   o   q u e   n ã o   i m p e d e   d e   q u e   h a j a   c r i s e s   d e   c o n f i a n ç a   c a u s a d a s   p r i n c i p a l m e n t e   p e l a   c o r r u p ç ã o .   “ A   c o n f i a n ç a   d a   p o p u l a ç ã o   n o s   p o l í t i c o s   n o   B r a s i l   e s t á   n o   n í v e l   m a i s   b a i x o   p o s s í v e l ,   o   q u e   f e z   o   p a í s   e s c o l h e r   u m   l í d e r   a u t o r i t á r i o .   I s s o   n ã o   s i g n i f i c a   q u e   é   a   m o r t e   d a   d e m o c r a c i a ,   m a s   é   u m   r i s c o . ”   E   c i t o u   a   V e n e z u e l a   c o m o   e x e m p l o .   “ N a   é p o c a   e m   q u e   C h á v e z   c h e g o u   a o   p o d e r ,   a   V e n e z u e l a   e r a   u m a   d e m o c r a c i a   m a d u r a ” .,U m   p o s s í v e l   n o v o   g o v e r n o   m i l i t a r   t a m b é m   e s t e v e   e m   d e b a t e ,     m a s   p a r a   o   e x - p r e s i d e n t e   F e r n a n d o   H e n r i q u e   C a r d o s o   a   a t u a l   s i t u a ç ã o   d o   p a í s   é   d i f e r e n t e   d a   d e   6 4 .   “ A   i m p r e n s a   e s t á   l i v r e ,   h á   l i b e r d a d e .   N ã o   e x i s t e   a m e a ç a   o r g a n i z a d a   d a s   F o r ç a s   A r m a d a s .   N ó s   t e m o s   m u i t o s   m i l i t a r e s   n o   p o d e r ,   é   v e r d a d e ,   m a s   d a   r e s e r v a .   N ã o   e x i s t e   a   c o r p o r a ç ã o   m i l i t a r   q u e r e n d o   m a n d a r ,   c o m o   e m   6 4 .   N ã o   h á   u m a   i d e o l o g i a ,   u m a   c o n c e p ç ã o   d o s   m i l i t a r e s .   E u   a t é   d i r i a   o   c o n t r á r i o .   O   q u e   n o s   f a l t a   é   u m   p r o j e t o ,   u m   r u m o   p r a   e s s e   p a í s ” .,A   c o n f e r ê n c i a   s o b r e   p o l í t i c a   b r a s i l e i r a   a i n d a   c o n t a   c o m   a   p a r t i c i p a ç ã o   d e   n o m e s   c o m o   o   v i c e - p r e s i d e n t e   H a m i l t o n   M o u r ã o ;   o s   m i n i s t r o s   d o   S T F   L u i s   R o b e r t o   B a r r o s o   e   D i a s   T ó f f o l i ;   o s   c a n d i d a t o s   à   p r e s i d ê n c i a   n a   ú l t i m a   e l e i ç ã o   C i r o   G o m e s ,   G e r a l d o   A l c k m i n ,   H e n r i q u e   M e i r e l l e s   e   G u i l h e r m e   B o u l o s ;   o   p r e s i d e n t e   d o   B N D E S   J o a q u i m   L e v y ;   o   e x - p r e s i d e n t e   F e n a n d o   H e n r i q u e   C a r d o s o ;   e   t a m b é m   c o n t a r á   c o m   a   p r e s e n ç a   d e   T i t e ,   t é c n i c o   d a   S e l e ç ã o   q u e   s u b s t i t u i   P e l é ,   q u e   p r e c i s o u   s e   a u s e n t a r   p o r   p r o b l e m a s   d e   s a ú d e .   M a i s   c e d o ,,.   A   5 . ª   e d i ç ã o   d a   B r a z i l   C o n f e r e n c e   i r á   a t é   d o m i n g o   ( 7 ) .",Populares,https://www.gazetadopovo.com.br/republica/brazil-conference-fhc-harvard/
