_id,author,date,section,sub_title,text,title,url
47,Folhapress,,mundo,,"A Otan (Organização do Tratado do Atlântico Norte) chega nesta
quinta-feira (4) aos 70 anos reforçada para enfrentar o mesmo inimigo que
motivou sua criação sobre os escombros da Segunda Guerra Mundial: Moscou. Saiu a União Soviética, entrou a Rússia de Vladimir Putin, mas a razão
existencial da aliança militar que começou com 12 membros e hoje tem 29 é a
mesma. A Otan mantém também a tradição de dissenso, marcada pelo
rompimento de 40 anos com a França. A ascensão ao poder de Donald Trump nos EUA
desestruturou a aliança, chamada por ele de obsoleta e esnobada em reuniões
como a de chefes de governo ocorrida no ano passado. Trump se apoia numa velha queixa americana: pagar a conta dos europeus
na manutenção de uma paz que basicamente é europeia. É meia verdade. Embora Washington seja responsável por 70% dos US$ 907
bilhões de gastos militares da Otan em 2018, essa conta inclui todas
as operações globais dos americanos. O desembolso só em ações europeias é menor, na casa dos US$ 30 bilhões, segundo o Instituto Internacional de Estudos Estratégicos, de Londres.   A mesma instituição, contudo, calcula que de 2014 para 2018 o
gasto militar dos membros europeus da Otan cresceu
13%, e o índice de operacionalidade de suas tropas aumentou na sua fronteira
com a Rússia, os países bálticos. ""A elite russa, não só Putin, vê a Otan como um ente americano
destinado a colocar mísseis e forças o quão mais próximo do Kremlin for
possível. Essa é a razão da desconfiança"", diz o analista militar russo
Ruslan Pukhov, do Centro de Análise de Estratégias e Tecnologias, de Moscou. Essa percepção mútua de agressão gera uma situação
incontornável. Putin guerreou com a Geórgia e atacou a Ucrânia para deixar
claro que não aceita mais a Otan em
suas fronteiras. O grande aumento da aliança em 2004, incluindo ex-repúblicas soviéticas, jogou no lixo dez anos de parceria do Ocidente com Moscou. Foi definitiva para cimentar as desconfianças russas, que já eram grandes quando a Otan atacou a sua aliada Iugoslávia e forçou a separação de Kosovo, em 1999. Já os ocidentais veem as ações beligerantes do russo como a
razão ideal para justamente buscar esse reforço. Fatores históricos pesam: a ocupação soviética dos três Estados
Bálticos é um trauma nacional não resolvido, e a Polônia tem razões de sobra
para desconfiar de Moscou. Esses países menores são os que, paradoxalmente, mais se
aproximam ou até ultrapassam a meta estabelecida de um gasto militar de 2% do
PIB em 2024, que Trump gostaria de ver dobrada. EUA, obviamente, lideram o ranking com 3,39%. Dos outros seis
países que cumprem a meta, quatro são ex-comunistas, três deles os bálticos
Estônia, Letônia e Lituânia. Mastodontes econômicos ficam para trás: a Alemanha só despende
1,23% de seu enorme PIB com defesa. Com o descompasso, a integração das forças europeias que está na agenda do francês Emmanuel Macron parece quimérica. ""Digamos que estamos na direção certa, mas não na velocidade certa"", afirma o chefe de vendas e marketing da gigante Airbus Defence and Space, Bernhard Brenner.   Em conversa com a Folha de S.Paulo durante a LAAD, feira militar
no Rio, ele foi cauteloso ao falar do projeto do futuro caça de quinta geração
europeu, um dos símbolos dessa interação. No ano passado, Alemanha e França se uniram para iniciar o
projeto, uma quebra de paradigma: franceses sempre tiveram indústria militar
independente, orientada para exportação e com poucas firulas diplomáticas com
clientes suspeitos. ""Hoje temos o Eurofighter (consórcio europeu) e o Rafale
(Dassault francesa). Vamos trabalhar por um produto conjunto"", afirmou. Ele vê com mais otimismo, especialmente porque sua empresa será
a beneficiada, a iniciativa de alguns membros da Otan (Alemanha, Bélgica,
Luxemburgo, Holanda e República Tcheca) de integrar uma frota multinacional de
aviões-tanque. ""É uma forma de otimizar gastos por hora de voo"",
afirma. A Airbus forneceria o avião, o A330-MRTT. Esse tipo de programa desvia, claro, da função inicial da Otan – a defesa mútua de seus
membros. Ela só ocorreu uma vez, quando os EUA foram atacados no 11 de
setembro, e a organização colaborou com tropas no Afeganistão. Mas até aqui a aliança não se mostrou capaz de agir sem os EUA.
Seu primeiro combate de fato ocorreu só em 1994, durante a guerra da Bósnia,
quando derrubou aviões de separatistas sérvios em área proibida. Além de Putin e Trump, há outros pontos de atrito na aliança, notadamente entre regimes que variam entre a autocracia e a chamada democracia iliberal. No primeiro grupo, a Turquia irritou a Otan ao adquirir sofisticados sistemas russos de defesa aérea, os S-400, tanto que  . No segundo, governos como o de Viktor Orbán na Hungria desafiam
o conceito democrático da aliança ao tomar medidas restritivas de independência
de Poderes. Com todos esses fatores, um divã talvez fosse o presente
adequado para a celebração que ocorrerá em Washington nesta quinta. 1949 - Os 12 países fundadores da Otan assinam o Tratado do
Atlântico Norte em Washington 1952 - Turquia e Grécia aderem 1955 - A Alemanha Ocidental se une à Otan, após anos de desnazificação 1956 - Primeira crise interna, com EUA se opondo à intervenção
franco-britânica na crise de Suez 1961 - A Guerra Fria eleva patamar com a construção do muro de
Berlim 1966 - França deixa a estrutura de comando da Otan, acusando excesso de poder
americano 1982 - Espanha entra na Otan 1989 - Cai o muro de Berlim, começo do fim do comunismo
soviético 1990 - Reunificação alemã, Alemanha Oriental deixa o Pacto de
Varsóvia 1991 - Fim da União Soviética e do Pacto de Varsóvia 1994 - Primeira ação militar da Otan: derrubada de quatro aviões
sérvios na Bósnia 1994 - Guerra na Chechênia expõe fraqueza militar russa; Moscou
adere a programa de parceria 1996 - Russos dão apoio a tropas da Otan na ex-Iugoslávia 1999 - Otan ataca
a Iugoslávia, início do afastamento russo; Polônia, Hungria e República Tcheca
aderem 2001 - Em resposta
ao 11 de Setembro, é invocado pela primeira vez o artigo 5 da Otan, de
defesa mútua em caso de agressão 2003 - Mais um
racha: países liderados pela Alemanha vetam Otan na Guerra do Iraque 2004 - Expansão ao
leste, com sete países ex-comunistas, inclusive os Estados Bálticos, elevando o
número de membros para 26 2008 - Para vetar
adesão à Otan, Rússia trava guerra com a Geórgia 2009 - França volta
ao comando militar da Otan; Albânia e Croácia aderem 2011 - Com mandato
da ONU, Otan controla espaço aéreo da Líbia 2014 - Rússia anexa
a Crimeia e intervém no leste da Ucrânia para evitar adesão de Kiev ao Ocidente 2017 - Montenegro
adere à Otan 2018 - Racha entre
EUA de Trump e Otan cresce com cobranças americanas por mais gasto",Populares,https://www.gazetadopovo.com.br/mundo/otan-chega-aos-70-enfrentando-velhos-fantasmas-e-inimigos-internos/
46,Gazeta do Povo,,parana,,"O ex-governador do Paraná  foi solto por volta das 19 horas desta quinta-feira (4), beneficiado por um habeas corpus c . O tucano estava preso no Complexo Médico Penal, em Pinhais, desde o dia 19 de março, no âmbito da Operação Quadro Negro, que apura desvios de recursos públicos em obras de escolas. Ao deixar o local, dentro de um carro, o tucano não falou com a imprensa.   Apesar da vitória no tribunal - a   pela soltura após 17 dias de detenção -, foram impostas medidas cautelares ao político. Ele terá de entregar o passaporte, não poderá ter contato com os demais réus, deverá se manter em recolhimento domiciliar durante a noite e nos fins de semana, além de ficar proibido de trabalhar para instituições públicas. Em nota oficial, a defesa de Beto Richa afirma que ""acredita na restauração de legalidade e que segue confiante nas instituições do Poder Judiciário, em especial do Tribunal de Justiça do Estado do Paraná"" e promete que ""esclarecerá no curso do processo todos os fatos necessários à demonstrar a inocência do ex-governador"". Trata-se da terceira prisão do tucano, que já foi alvo da  , em setembro de 2018, e da  , em janeiro deste ano. ",Populares,https://www.gazetadopovo.com.br/parana/beto-richa-solto-prisao/
55,Estadão Conteúdo,,republica,,"A Advocacia-Geral da União solicitou a anulação do acordo bilionário da Lava Jato com a Petrobras, em    pedido enviado ao ministro do Supremo Tribunal Federal (STF) Alexandre de Moraes. Pelo acordo da Lava Jato, pelo menos  , inclusive, pelos procuradores que compõem a força-tarefa da operação que desmantelou esquema de cartel e propinas na estatal petrolífera. A a força-tarefa da Lava Jato no Ministério Público Federal (MPF) de Curitiba anunciou um recuo na intenção. A AGU argumenta que devem ser reconhecido que ""os valores objeto das sanções impostas pelos Estados Unidos no caso revertam, em sua integralidade, à União"". :  O ""Acordo de Assunção de Compromissos"" entre o Ministério Público Federal no Paraná, base da Lava Jato, e a Petrobras foi homologado pela 13.ª Vara Criminal Federal de Curitiba. O pacto foi contestado pela própria Procuradoria-Geral da República, na Arguição de Descumprimento de Preceito Fundamental 568, sob relatoria de Alexandre de Moraes. O parecer da AGU é subscrito pelo advogado-geral da União André Mendonça, e ainda por Izabel Vinchon Nogueira de Andrade (secretária-geral de Contencioso) e Maria Helena Martins Rocha Pedrosa (advogada da União). AGU pede que ""seja reconhecida a nulidade do acordo de assunção de obrigações celebrado entre o Ministério Público Federal e a Petrobras"". Pede, ainda, que ""seja reconhecido que, no Brasil, a sanção aplicada nos Estados Unidos corresponde à multa própria prevista na Lei Anticorrupção (Lei nº 12.846/2013), de natureza administrativa e cuja competência para aplicação é da Controladoria-Geral da União"". Para a AGU, nos termos da Lei Anticorrupção ""compete à Controladoria-Geral da União representar a sociedade e Estado brasileiro no tocante à internalização das sanções impostas pelos Estados Unidos à Petrobras em decorrência dos ilícitos relacionados à denominada Operação Lava Jato"". ""Subsidiariamente, nos termos do artigo 131 da Constituição, compete à Advocacia-Geral da União essa representação."" :  O parecer indica que deve ser reconhecido que ""os valores objeto das sanções impostas pelos Estados Unidos no caso revertam, em sua integralidade, à União, na qualidade de representante da sociedade brasileira, vítima dos ilícitos praticados no âmbito da Petrobras"". Em outro trecho do documento, a Advocacia-Geral da União diz que ""via de regra, valores recebidos pelo Estado brasileiro em decorrência da internalização de penalidades dessa natureza devem ser destinados e utilizados em estrita conformidade com as normas constitucionais e legais de natureza financeira e orçamentária do país"". ""Por fim, seja reconhecido que, diante das peculiaridades do acordo firmado pela Petrobras com autoridades norte-americanas, em especial no que se refere à cláusula de não reversão das penalidades em benefício da Companhia brasileira, é excepcionalmente legítima a destinação fundiária dos valores devidos à União na espécie, mediante aplicação analógica da legislação do FUNPEN (artigo 2.º, inciso IV, da LC nº 79/1994).""",Populares,https://www.gazetadopovo.com.br/republica/agu-tenta-anular-acordo-bilionario-que-cria-fundo-gerido-por-procuradores-da-lava-jato/
92,,,wiseup-news,,,,https://www.gazetadopovo.com.br/wiseup-news/in-israel-president-bolsonaro-insists-on-historical-revisionism-2/
91,"Vandré Kramer, com Estadão Conteúdo",,economia,,"Uma batalha está sendo travada nos céus brasileiros. Em jogo, estão os 11,6% de participação da Avianca Brasil, , no mercado doméstico de passageiros, segundo a Agência Nacional de Aviação Civil (Anac).   Mas também poderá ter acesso a rotas altamente rentáveis e ampliar a presença em alguns dos mais movimentados aeroportos do país, como os de Congonhas e Guarulhos, em São Paulo, e o Santos Dumont, no Rio de Janeiro.   As três maiores empresas aéreas brasileiras - a Gol, a Latam e a Azul -, que juntas têm 88,1% do mercado nacional - se credenciaram à disputa. “Vai ser concorrido”, prevê o economista Pedro Coelho Afonso, da PCA Capital.   O filé mignon são os slots (autorizações para pouso e decolagem) em Congonhas e no Santos Dumont. Na capital paulista, são 21, e na fluminense, 17. Isto cria oportunidades de expandir a atuação em uma das pontes aéreas mais movimentadas do mundo   “São ativos estratégicos. E possibilitam ocupar maior espaço onde a demanda já existe”, afirma Bruna Pezzin, analista da XP Investimentos. Ela sintetiza que é uma disputa por ativos que possam agregar valor às empresas.  Outro importante ativo é a participação no mercado. Atualmente. a Gol tem a maior participação, com 37,2% do mercado; seguida pela Latam, com 30,4% e pela Azul, com 20,6%. “O vencedor ou os vencedores podem ter um ganho forte de share”, diz Ilan Arbetman, analista da Ativa Investimentos.    Um triunfo da Gol ou da Latam poderia significar uma maior concentração do mercado, o que poderia levar o Conselho Administrativo de Defesa Econômica (Cade) ou a Anac a entrar no processo para evitar prejuízos ao consumidor. Segundo Arbetman, essas duas empresas têm uma posição mais dominante no mercado.   Quem pode estar largando na frente nessa disputa é a Azul. Ela ainda não tem uma presença significativa em Congonhas, um dos aeroportos mais movimentados do país; tem mais caixa, e pode ter ganhos de sinergia, já que o principal modelo da frota da Avianca, o Airbus 320, é a espinha dorsal da expansão da terceira maior companhia aérea brasileira, e não tem muita sobreposição de rotas.   Segundo o analista da Ativa, os ganhos de sinergia da Gol seriam mais demorados, já que a frota dela é composta por aviões da Boeing   “A Azul tem uma posição de caixa mais favorável, o que permitiria fazer a aquisição com recursos próprios”, afirma Vinícius Andrade, da Toro Investimentos. “Isso lhe permite ser mais agressiva no leilão.”   ""A maior parte desse valor, porém, se refere a ativos que a companhia não tem. Nesse ponto é que entra o governo"", observa o analista, se referindo aos 70 slots envolvidos na negociação, que não são de propriedade da Avianca e sim uma concessão.   As companhias aéreas Gol e Latam foram abordadas pela gestora americana Elliott, maior credor da dívida da Avianca Brasil, em conjunto - para participar de proposta de reestruturação. A proposta é semelhante, com compromisso pelas aéreas a conceder empréstimos para a Avianca e fazer ofertas em leilão no valor mínimo de US$ 70 milhões por pelo menos uma unidade orodutiva Isolada (UPI).   A Elliott apresentará um plano de recuperação judicial revisado para a Avianca Brasil. O plano prevê a constituição de sete UPIs a serem leiloadas, das quais seis deverão conter os direitos de uso dos horários de pouso e decolagem de voos atualmente detidos nos aeroportos de Congonhas, Santos Dumont e Guarulhos, bem como certificados de operador aéreo. Além disso, uma UPI deverá deter os ativos relacionados ao programa de milhagem Amigo. No leilão, será permitida a oferta por qualquer interessado.",Populares,https://www.gazetadopovo.com.br/economia/batalha-nos-ceus-por-que-a-avianca-mesmo-em-recuperacao-judicial-e-tao-cobicada-9nbqoq58baua2qthxgzs2g6y6/
15,Moreno Valério,[05/04/2019],esportes,PARANAENSE,"O técnico do  , Umberto Louzer, irá praticamente repetir o time da última partida na semifinal da Taça Dirceu Krüger, o segundo turno do Paranaense. O jogo será  contra o Londrina, neste domingo (7), às 16h no Couto Pereira. A única alteração será a saída do zagueiro Sabino, que sofreu uma lesão muscular na coxa, e dará lugar a Romércio. Com isso, um provável Coritiba conta  
 
 
 
 
 O treinador admitiu estar encontrando a base do seu time para a Série B. “Sim, estamos nessa fase de conhecer os atletas e trabalhar a melhor formação”, declarou o comandante. Louzer ainda defendeu a entrada do volante Vitor Carvalho, que vinha sendo criticado pela torcida nas atuações antes do clássico com Paraná. “A gente precisa atacar mas ser bem organizado e o Vitor nos da possibilidade disso, ele articula”, afirmou. O técnico ainda pediu o apoio dos torcedores no estádio. “Conto com o apoio do nosso torcedor. Já convoco todos a empurrar o Coritiba para que juntos possamos comemorar ao fim do jogo”, finalizou. 
 Você pode receber mensagens instantâneas, via WhatsApp, para ficar bem informado sobre tudo o que vai acontecer no Paranaense, Copa do Brasil, Série B e até alguns dos piores momentos dos rivais – assim como vídeos e fotos exclusivas de jogos e treinos. . É muito simples. Junte-se a nós na lista de transmissão de notícias do Coxa Doido. Seja bem-vindo ao nosso grupo! 
 O futebol  no seu celular. Você pode receber mensagens instantâneas, via  , para ficar bem informado sobre tudo o que vai acontecer nos principais clubes do país. Para receber diariamente as principais notícias, resultados e classificação, basta seguir os passos abaixo. É muito simples. Junte-se a nós no Brasileirão 2019!!!  
 
","Técnico do Coritiba confirma novidade na zaga, valoriza volante e convoca torcida para semifinal com o Londrina",https://www.gazetadopovo.com.br/esportes/coritiba/tecnico-do-coritiba-confirma-novidade-na-zaga-valoriza-volante-e-convoca-torcida-para-semifinal-com-o-londrina-8c2l70du7uf1g54anzfcwg8dd/
9,,05/04/2019 |,agronegocio,,,Suspensão de frigoríficos não impediu alta de 15% na exportação de frango para os árabes no 1.º trimestre,https://www.gazetadopovo.com.br/agronegocio/agricultura/outras-culturas/suspensao-de-frigorificos-nao-impediu-alta-de-15-na-exportacao-de-frango-para-os-arabes-no-1-trimestre-1rp6ldhgagt61wsoh1btrua8x/
110,Gazeta do Povo,,republica,,"O ministro da Economia, , explica a   do governo Bolsonaro a deputados da Comissão de Constituição e Justiça (CCJ) da Câmara, nesta quarta-feira (3). Os parlamentares estão questionando e debatendo com o ministro os pontos da proposta de emenda à Constituição (PEC) que muda o sistema de aposentadoria no Brasil. A audiência da CCJ começou às 14 horas e a previsão é de que dure pelo menos quatro horas. A audiência havia sido inicialmente marcada para terça-feira da semana passada, dia 26. Mas  . Oficialmente, a explicação era de que não havia motivo de ele ir à CCJ porque a comissão ainda não havia escolhido um relator da PEC (o que acabou ocorrendo posteriormente; a proposta será relatada pelo deputado Marcelo Freitas, do PSL-MG). Nos bastidores, contudo, a avaliação é de que Guedes preferiu evitar ser alvo de críticas profundas, pois os atritos do Planalto com o Congresso estavam no auge naquele momento. Depois disso, o governo conseguiu esfriar os ânimos na Câmara. Acompanhe ao vivo:  ",Populares,https://www.gazetadopovo.com.br/republica/vivo-paulo-guedes-explica-reforma-previdencia-aposentadoria-ccj-camara-deputados/
48,Gazeta do Povo,,republica,,"Em um telegrama confidencial enviado pelo Itamaraty nesta
quarta-feira (3) à ONU, o governo Bolsonaro afirmou que “não houve golpe de
Estado” no dia 31 de março de 1964. A informação é da BBC Brasil, que teve
acesso ao conteúdo integral do telegrama. A mensagem foi endereçada a Fabian Salvioli, relator especial
da ONU sobre Promoção da Verdade, Justiça, Reparação e Garantias de Não
Repetição. A carta é uma resposta a
Salviole, que na última sexta-feira (29) classificou os planos de comemoração de
31 de março como “tentativas de revisar a história
e justificar ou relevar graves violações de direitos humanos do passado devem
ser claramente rejeitadas por todas as autoridades e pela sociedade como um
todo"". A mensagem do relator da ONU foi enviada quatro dias após a divulgação, através do porta-voz da Presidência, general Otávio Santana do Rêgo Barros, de que  . No dia 28, o governo mudou o tom e o presidente diz que a   o golpe de 1964. Para o argentino, as celebrações são “imorais e inadmissíveis”. Contudo, o governo rebateu no telegrama, afirmando que o governo militar teria sido necessário à necessidade do governo ""para afastar a crescente ameaça de uma tomada comunista do Brasil e garantir a preservação das instituições nacionais, no contexto da Guerra Fria"". No último dia 29 de abril, Fabian Salvioli
classificou os crimes cometidos na ditadura como horrendos. “Comemorar
o aniversário de um regime que trouxe tamanho sofrimento à população brasileira
é imoral e inadmissível em uma sociedade baseada no Estado de Direito. As
autoridades têm a obrigação de garantir que tais crimes horrendos nunca sejam
esquecidos, distorcidos ou deixados impunes"", escreveu Salvioli. Nesta quarta-feira (3), o governo classificou as críticas como “sem fundamentos.”. [Fabian Salvioli] deve respeitar os processos nacionais e procedimentos internos em suas deliberações"", teria escrito o Itamaraty, na carta obtida pela BBC. Também
na última sexta-feira (29), a juíza Ivani Silva da Luz, da 6ª Vara da Justiça
Federal, em Brasília, acatou um pedido de liminar da Defensoria Pública da
União e determinou a proibição de que o governo realize a comemoração do
aniversário de 55 anos do golpe militar de 1964. A
liminar foi caçada no sábado pela desembargadora
Maria do Carmo Cardoso, do Tribunal Regional Federal da 1ª Região (TRF-1). .",Populares,https://www.gazetadopovo.com.br/republica/governo-bolsonaro-comunica-a-onu-que-golpe-militar-e-fake-news/
108,Luan Galani*,,haus,,,"
                        ",https://www.gazetadopovo.com.br/haus/design/jaime-lerner-lanca-marca-propria-de-design-de-mobiliario-e-apresenta-mesa-inedita/
107,,,materias,,,"
                        ",https://guia.gazetadopovo.com.br/materias/mostra-mon-ai-weiwei/
105,Folhapress,,economia,,"Uma atualização do WhatsApp anunciada nesta quarta-feira (3) permitirá que usuários do aplicativo decidam se querem participar de um novo grupo. A nova função deixará que a pessoa escolha autorizar cada nova inclusão em um grupo ou decida, de antemão, que apenas contatos já salvos na agenda poderão adicioná-los. Quem habilitar a função poderá também manter a conta aberta para inclusão automática de desconhecidos. As opções serão “Ninguém”, para aprovar todas as solicitações, “Meus contatos”, para pré-aprovar a agenda de contatos, ou “todos”, que mantém o sistema como é hoje.  A configuração aparecerá no caminho Configurações > Conta > Privacidade > Grupo. Segundo comunicado divulgado pelo WhatsApp, quem quiser incluir um telefone novo deverá mandar uma mensagem privada, e o convite deverá ser respondido em três dias. A ferramenta está disponível na versão mais recente do app, que está sendo liberada aos usuários a partir desta quarta. Logo do WhatsApp, que mudou regras para inclusão em grupos Dado Ruvic/Reuters Logo verde do WhatsApp espelhado e com o fundo verde   ",Populares,https://www.gazetadopovo.com.br/economia/whatsapp-deixara-usuario-decidir-se-quer-entrar-em-grupo-6j8txlkjah3ny121ocb5fni3l/
