_id,author,date,section,sub_title,text,title,url
56,"Luan Sperandio, especial para a Gazeta do Povo",,ideias,,"Uma   levou ao encerramento da audiência na Comissão de Constituição e Justiça da Câmara na noite desta quarta-feira (03). O objeto era a proposta de reforma da Previdência feita pelo governo Bolsonaro. O conflito se deu quando o petista afirmou que o ministro age como ""tigrão"" em relação a aposentados, idosos e pessoas humildes, mas como ""tchutchuca"" no tocante à ""turma mais privilegiada do nosso país"". Há um problema na análise de Zeca Dirceu: para adotar o mesmo termo esdrúxulo, ninguém neste país foi mais “tchutchuca” de poderosos e bilionários do que o partido ao qual Zeca Dirceu é filiado, e que ficou 14 anos, 5 meses e 12 dias no poder. Houve diversos programas de transferência de renda dos mais pobres para os mais ricos protagonizados por mandatários do Partido dos Trabalhadores enquanto estiveram no Palácio do Planalto. As críticas direcionadas a Guedes são, basicamente, fruto de um desconhecimento acerca da urgência de reformar a Previdência e sobre quem ela irá afetar, uma vez que o ônus é falsamente atribuído aos brasileiros de menor renda. É estimado que em dez anos ela poderá gerar R$ 1,1 trilhão de economia. Ocorre que todo gasto do governo é custeado mediante tributação, seja impostos, dívida pública ou emissão de moeda. Ao economizar por meio de um ajuste do sistema previdenciário, busca-se equilibrar as contas públicas. A União não consegue fazer um superávit primário — despesa do governo inferior ao que ele arrecada em impostos — desde 2014. Além de insustentável, a atual Previdência é injusta:  . Já 41% é destinada aos 20% de brasileiros de maior renda. Enquanto o  , o  , sendo destinada a apenas 9 milhões de beneficiários. Quão mais tímido é o ajuste, mais prejudicados serão os mais pobres, já que o status quo os afeta de maneira negativa. Assim, ainda que indiretamente, a aprovação da reforma da Previdência é que beneficiará os mais pobres:  . Sem um ajuste, tenderá a haver menor crescimento, bem como aumento dos juros e impostos. Segundo levantamento de Felippe Hermes, do site  , durante o governo Lula, a despesa do governo cresceu 2,4% do PIB. Todavia, apenas 0,05% disso foi para a saúde, 0,2% para a educação e, mais da metade, 1,37%, para Previdência. Tamanho aumento de gasto é o resultado de postergar a reforma. Da forma como funciona hoje em dia, a  . Para além das falsas narrativas defendidas pelo partido, selecionamos 4 oportunidades principais em que o PT foi a tchutchuca de poderosos, e quem pagou a conta do baile foi você. A estratégia, idealizada pelo economista Luciano Coutinho, mas abraçada por Lula e, posteriormente, Dilma, era escolher determinadas companhias para se tornarem gigantes em seus setores e competir no mercado internacional. E tudo isso turbinado a partir de empréstimos do BNDES. Os juros eram subsidiados. Empresas que não eram amigas do governo tinham de competir arcando com taxas de juros mais altas, cobradas pelo mercado. Boa parte dos empréstimos foi feita com juros negativos, ou seja, a devolução dos valores contratados era inferior à inflação do período. Em um período de nove anos, entre maio de 2007 e maio de 2016, a  , valor equivalente a 40 vezes o atual orçamento do Bolsa Família — previsto para R$ 30 bilhões em 2019. Esse montante era destinado geralmente a empresas amigas, como o frigorífico JBS, a telefônica Oi e a petroleira OGX de Eike Batista. Os ex-presidentes contribuíram com   para que empreiteiras brasileiras realizassem obras em países da África e América Latina. Essa quantia corresponde a 93% do que foi desembolsado pelo banco estatal para exportação de bens e serviços. A Odebrecht, sozinha, abocanhou 64% do total. Foi o auge do capitalismo de laços — um sistema que se realiza mediante a criação de alianças e emaranhados comerciais estabelecidos entre grupos privados com o governo, na definição do professor do Insper Sérgio Lazzarini. O gasto com essa festa de crédito foi superior ao do  , realizado pelos Estados Unidos para ajudar na reconstrução da Europa após a II Guerra Mundial. Em 2009 o então presidente Lula afirmou, na cúpula das nações africanas, que “ ”. Não à toa, enquanto sua agremiação esteve no comando do Executivo, bilhões em impostos arrancados do trabalhador brasileiro foram destinados a ditaduras. Diversos desses contratos são caixas-preta até os dias atuais. Foram construídas obras de infraestrutura, como rodovias, ferrovias e aeroportos, sobretudo em países da América Latina e na África. Segundo o jornal O Globo,  , uma vez que são realizados com recursos do FAT, um fundo financiado com parte dos salários de cada trabalhador brasileiro. Angola, Congo, Cuba, Gabão, Guiné Equatorial, Moçambique, Venezuela e Zimbábue foram os destinos prediletos dos presidentes petistas.  . Segundo as investigações da Operação Lava Jato, as maiores empreiteiras do país formaram um cartel e dividiam as obras que cada um ganharia com a Petrobrás. Tudo sob o comando do PT, mas com favorecimentos ainda ao MDB e PP.  No meio disso, empresas como Odebrecht e OAS, além da Camargo Corrêa e Andrade Gutierrez foram largamente as maiores beneficiárias pelo governo petista — embora houvesse várias outras — e retribuíram com pagamento de vultosas quantias de propina. A  , segundo delações premiadas. Entre os principais benefícios, ampliação de crédito para exportação a Angola e aprovação de medida provisória de Refis. Já em relação a OAS,  . A empresa tinha desejo de incrementar negócios em países como Peru, Chile, Costa Rica, Bolívia, Uruguai e nações africanas. lula se prontificou em ajudá-los. Em retribuição, foram feitas obras e reformas no sítio em Atibaia e no triplex do Guarujá, pelos quais Lula foi condenado. Ademais, a OAS deu  . O Grupo Andrade Gutierrez fez doações ao PT em troca de favorecimento em contratos com estatais. Entre as denúncias, consta que bancou pagamentos de fornecedores da eleição da presidente Dilma Rousseff, em 2010, no valor de R$ 6,1 milhões, além de outros R$ 10 milhões na campanha de 2014. Estima-se que  . Segundo  , homem forte tanto do ex-presidente Lula quanto de Dilma, pelo menos 900 das mil medidas provisórias editadas nos quatro governos do PT motivadas por propinas. Embora possa haver uma imprecisão nas informações — o PT editou 623 MPs —, e a delação ainda seja alvo de trâmite processual, há fortes evidências de que em algumas das MPs houve negociações ilícitas para inserir determinados conteúdos que beneficiassem grupos privados. Entre elas, duas são alvo de ações penais, como a MP 627, de 2013, que prorrogou incentivos fiscais destinados a montadoras de veículos, além da MP 471, de 2009, que também beneficiou montadoras com a prorrogação de incentivos fiscais.  , e ainda respondem por ação penal que investiga o caso.",Populares,https://www.gazetadopovo.com.br/ideias/4-vezes-em-que-o-pt-foi-a-tchutchuca-de-poderosos-e-voce-pagou-a-conta-do-baile/
58,Washington Post,,mundo,,"Apenas um mês depois de sediar uma  , o Vietnã deportou três refugiados norte-coreanos, enviando-os para a China para um futuro incerto em sua terra natal. As deportações marcam um preocupante novo capítulo para fugitivos norte-coreanos, que antes estavam seguros se conseguissem escapar da captura na China e chegar a um terceiro país. As deportações também podem ser uma indicação da crescente
influência diplomática e menor isolamento da Coreia do Norte desde que Kim
subiu ao palco global no ano passado. ""Estou preocupado que o envolvimento diplomático de Kim
Jong Un com o Vietnã possa tê-los influenciado a deportar os refugiados
norte-coreanos"", disse Sokeel Park, diretor da Coreia do Sul para um grupo
chamado Liberdade na Coreia do Norte, que ajuda refugiados norte-coreanos a
cruzar fronteiras e se adaptar à vida no sul. Mas grupos de refugiados também culparam o governo da Coreia do Sul, em meio a relatos de que o país não respondeu prontamente a um pedido para ajudar os refugiados depois que eles foram presos no Vietnã. Refugiados norte-coreanos na Coreia do Sul acusam o governo de Seul de colocar os laços com Pyongyang antes das questões de direitos humanos. Funcionários humanitários disseram ao jornal sul-coreano Chosun Ilbo que o Ministério das Relações Exteriores da Coreia do Sul não respondeu a um pedido para ajudar os refugiados, uma afirmação que o ministério negou. Três norte-coreanos que fugiram de seu país via China foram
presos na cidade vietnamita de Ha Tinh na segunda-feira (1º), de acordo com o Chosun
Ilbo. Trabalhadores humanitários que estavam ajudando os refugiados entraram em
contato com a embaixada sul-coreana no Vietnã e foram orientados a contatar
diretamente o Ministério das Relações Exteriores de Seul. O ministério repetidamente disse a eles que esperassem, mas
nenhuma assistência foi fornecida antes que os refugiados fossem enviados à
China na quarta-feira, disseram os trabalhadores humanitários ao Chosun Ilbo. A
China vê os desertores norte-coreanos como migrantes econômicos ilegais e os
repatria para seu país de origem, onde eles enfrentam severas punições. O Ministério das Relações Exteriores em Seul negou o relato,
dizendo em um comunicado que o ministério ""imediatamente entrou em contato
com as autoridades locais e tomou uma posição contra a repatriação forçada para
a Coreia do Norte"". O ministério se recusou a comentar sobre a segurança e
o paradeiro dos refugiados. Han Jin-myung, um diplomata norte-coreano que serviu no Vietnã antes de desertar para a Coreia do Sul em 2015, disse que o governo de Seul deveria ter agido mais rapidamente. ""O Vietnã está em uma posição delicada, politicamente
próximo à Coreia do Norte e economicamente perto da Coreia do Sul. Apenas o
governo de Seul pode tomar a iniciativa de resgatar esses refugiados"",
disse ele. ""O Vietnã não poderia tê-los deportado se os sul-coreanos
prontamente interviessem. É irresponsável para o governo de Seul deixar isso
acontecer"". O Vietnã tem sido um dos países do Sudeste Asiático que
oferecem abrigo seguro para fugitivos norte-coreanos, ajudando-os a chegar à
Coreia do Sul. ""Uma vez que os refugiados norte-coreanos consigam
passar pela China, eles normalmente estão seguros"", disse Sokeel Park.
""O fato de que eles foram repatriados do Vietnã, depois de tudo isso, é
realmente preocupante. Não queremos que isso estabeleça um precedente."" O número de norte-coreanos vindo anualmente à Coreia do Sul
caiu pela metade desde que Kim Jong Un chegou ao poder em 2011. Os legisladores
sul-coreanos atribuem a queda a controles de fronteira mais rígidos e à
repatriação de refugiados pela China para a Coreia do Norte.",Populares,https://www.gazetadopovo.com.br/mundo/pais-comunista-deporta-refugiados-de-outro-pais-comunista/
54,"
            ",,colunistas,,,"A reforma já se foi, mas isso agora é o de menos",https://www.gazetadopovo.com.br/colunistas/mario-vitor-rodrigues/a-reforma-ja-se-foi-mas-isso-agora-e-o-de-menos/
13,Folhapress e Gazeta do Povo,,mundo,,"O Equador planeja expulsar Julian
Assange de sua embaixada em Londres nas próximas “horas ou dias”, revelou o
WikiLeaks na noite desta quinta-feira (4). O país já teria acertado os
detalhes da prisão do ativista australiano com as autoridades do Reino Unido.
As informações foram vazadas ao WikiLeaks por um funcionário do alto escalão do
governo equatoriano. Assange vive na embaixada
equatoriana em Londres desde 2012 para evitar ser detido e extraditado para a
Suécia, onde era investigado por estupro. O processo foi arquivado pela Justiça
da Suécia, mas as autoridades britânicas ainda buscam prendê-lo. O fundador do Wikileaks nega as acusações de estupro e diz ser perseguido por ter vazado milhares de documentos revelando práticas espúrias de diversos governos ao redor do mundo, em especial dos Estados Unidos. Nesta sexta-feira, o ministro de Relações Exteriores do Equador, José Valencia, afirmou que o governo equatoriano não fará comentários sobre os atuais ""rumores infundados"" de que o país fez um acordo com o Reino Unido para prender Assange. ""Rumores da 'iminente' saída de Assange vêm de meses atrás. O governo não fará comentários sobre os atuais rumores infundados, que também são insultuosos. O Equador toma suas decisões de maneira soberana e independente de outros países"", afirmou Valencia pelo Twitter. O chanceler ainda disse que o asilo diplomático é uma faculdade soberana de um Estado, ""que tem o direito de outorgá-lo ou retirá-lo unilateralmente quando considere justificado"". O relator especial da ONU sobre tortura, Nils Melzer, disse que ficou ""alarmado"" com os relatos de que Assange pode ser expulso em breve da embaixada. ""Na minha opinião, se Assange fosse expulso da embaixada do Equador, ele provavelmente seria preso por autoridades britânicas e extraditado para os Estados Unidos"", disse Melzer. ""Tal resposta poderia expô-lo a um risco real de graves violações de seus direitos  humanos, incluindo a sua liberdade de expressão, seu direito a um julgamento justo e a proibição de um tratamento ou punição cruel, desumano ou degradante"", disse o especialista da ONU, que fez um apelo ao governo do Equador para que não expulse Assange de sua embaixada em Londres. A suposta decisão de revogar o asilo de Assange ocorre após o surgimento de denúncias de corrupção contra o presidente equatoriano, Lenín Moreno. O escândalo, apelidado de INA
Papers, envolveria o pagamento de pelo menos US$ 18 milhões (R$ 70 milhões) em
propina à família de Moreno por uma empreiteira chinesa. O governo nega as acusações,
afirmando que elas foram inventadas pelo ex-presidente Rafael Correa e
disseminadas por Assange com o intuito de prejudicar Moreno. Em março, o
Equador já havia decidido cortar o acesso de Assange à internet. Na terça-feira (2), o líder
equatoriano acusou Assange de “violar repetidamente” as regras de concessão de
asilo. “Não é que ele [Assange] não
possa se expressar livremente, mas ele não pode mentir, muito menos hackear
contas ou interceptar ligações telefônicas privadas”, declarou Moreno à
imprensa equatoriana. Em dezembro, o jornal New York
Times revelou que o governo equatoriano manteve negociações com autoridades
americanas sobre a expulsão de Assange em troca do alívio de dívidas. O debate sobre a revogação do
asilo de Assange reflete as disputas de poder travadas no Equador entre Moreno
e Correa, seu antecessor. Moreno foi eleito presidente em
abril de 2017, prometendo dar continuidade às políticas de esquerda de Correa.
No entanto, após chegar ao poder, Moreno se distanciou de seu padrinho político
e forjou alianças com partidos de centro e de direita. A concessão de asilo a Assange
conferiu a Correa credenciais anti-imperialistas em um momento em que a maior
parte dos países sul-americanos, inclusive o Brasil, tinha governos
identificados com a esquerda. Sob Moreno, o Equador busca reconfigurar suas alianças com os novos governos de direita na região e com os Estados Unidos.",Populares,https://www.gazetadopovo.com.br/mundo/equador-esta-prestes-a-expulsar-assange-de-embaixada-em-londres-diz-wikileaks/
57,Folhapress,,economia,,"O ministro da Economia, Paulo Guedes, refutou pessoalmente o pleito das montadoras de reestabelecer o sistema de cotas que regulava o comércio automotivo entre Brasil e México. Em reunião na sexta-feira (29), no Rio de Janeiro, Guedes disse a representantes de três gigantes do setor -General Motors, Fiat e Volkswagen- que chegou a hora de abrir a economia. Segundo pessoas presentes ao encontro, o clima foi tenso. Um auxiliar do ministro chegou a afirmar que as montadoras receberam R$ 20 bilhões de subsídios em cinco anos, incluindo regimes regionais de apoio. Do lado do governo, Guedes chegou acompanhado de sete subordinados, incluindo três secretários: Marcos Troyo (Comércio Exterior), Carlos Costa (Produtividade) e Marcos Cintra (Receita Federal). Estiveram presentes cinco executivos, entre eles Antonio Filosa, presidente da Fiat, Carlos Zarlenga, presidente da GM, e Antonio Megale, diretor de Assuntos Governamentais da Volks. A reunião foi marcada após um pedido do governador de São Paulo, João Doria, que teria relatado ao ministro a queixa da GM de que o livre-comércio com o México pode comprometer os investimentos planejados pela empresa em troca de incentivos fiscais estaduais. Desde o dia 19, carros e autopeças circulam entre os dois países sem pagar tarifa de importação. As montadoras disseram a Guedes que o Brasil não é competitivo o bastante para isso. Argumentaram ainda que as empresas mexicanas seriam favoráveis à retomada das cotas, desde que acompanhadas de uma regra de origem mais branda. Quando o livre-comércio foi estabelecido, a exigência de peças produzidas localmente subiu de 35% para 40%. Guedes respondeu que o Brasil vai voltar a negociar com o México a partir da segunda quinzena de abril. O objetivo, porém, seria abrir mercados. O governo quer trocar a redução no conteúdo local dos carros por um acordo amplo, que contemple ônibus e caminhões e eventualmente outros setores da economia. Guedes também teria enumerado os esforços que vem fazendo para melhorar a competitividade das empresas, com desburocratização, o encaminhamento da reforma da Previdência e os planos de reforma tributária. Em razão disso, disse ele, não seria necessário reestabelecer as cotas com o México. A reunião entre Guedes e as montadoras marca uma mudança importante de posição do governo federal. Nos governos Luiz Inácio Lula da Silva e Dilma Rousseff, do PT, o setor foi agraciado com regimes especiais de impostos. O momento, no entanto, é delicado. Com os lucros em queda, as montadoras vêm ameaçando com demissões.  . Para a Anfavea (associação nacional dos fabricantes de automóveis), o acordo de livre comércio sem cotas coloca em risco a indústria nacional. Os custos menores de produção no México tornariam o Brasil menos atraente. Contudo, essa avaliação não é unânime entre as associadas.""O fluxo não é mais como antes, não tenho preocupação com uma invasão de produtos mexicanos e acredito que o acordo permite que façamos uma complementação. Hoje, pelos custos, é impossível produzir localmente nossa linha completa de veículos, há muita diversidade de tecnologias"", diz Rogelio Golfarb, vice-presidente da Ford na América do Sul. Hoje, a Ford traz do México o sedã Fusion. A montadora aguarda a definição sobre o local de produção do novo utilitário Escape, que também pode ser montado naquele país.",Populares,https://www.gazetadopovo.com.br/economia/montadoras-livre-comercio-paulo-guedes/
12,Camila Abrão,,republica,,"O presidente Jair Bolsonaro confirmou que irá cumprir uma  de suas promessas de campanha: está tudo certo conceder o 13º salário para o programa Bolsa Família, segundo o presidente. A decisão foi informada na live de ontem, rapidamente, e anunciada  na conta oficial do Twitter do presidente, nesta sexta (5).  Os recursos virão do combate a fraudes no programa, informa o presidente. Ele ressaltou um caso curioso para ilustrar a situação: “No passado, o PT negou no Senado o 13º para o Bolsa Família. Hoje, com árduo trabalho no combate às fraudes, como vereadores e o caso de um animal doméstico chamado gato “Billy”, recebendo indevidamente, temos meios para implementar esta medida para os verdadeiros necessitados.” No caso, o presidente Bolsonaro destaca que a situação será 'resolvida no executivo', sem passar pelas casas legislativas. Segundo o ministério da Cidadania, o custo será de R$ 2,5 bilhões. Citado por Bolsonaro, o gato Billy  fez parte da lista de beneficiários do programa durante cinco meses. O caso curioso ocorreu no município de Antônio João, no Mato Grosso do Sul, em 2008. Notícias da época mostraram que o bichano foi inscrito pelo coordenador do programa na cidade, Eurico Siqueira da Rosa, Billy pertencia à esposa de Eurico. :  Registrado como Billy Flores da Rosa, o gato tinha identificação social, cartão magnético e recebia R$ 20 mensais, como registrou o jornal  . Entre março e novembro de 2008, Billy recebeu a renda do programa, uma visita de um agente de saúde procurando por uma criança chamada Billy pôs fim a fraude.  Questionada pelo agente sobre onde estaria a criança, ela disse que o único Billy que conhecia era o gato. Em dezembro daquele ano, Eurico foi exonerado do cargo e alegou que a família passava necessidade, por isso teria inscrito Billy, o gato, no Bolsa família.  O ministro da Cidadania, Osmar Terra,  . O valor estimado para fazer valer a decisão é de aproximadamente R$ 2,5 bilhões. ",Populares,https://www.gazetadopovo.com.br/republica/quem-e-o-gato-billy-o-bichano-inscrito-no-bolsa-familia-que-nao-vai-receber-13o-salario/
